"Product ID","SKU","Product Name","Price","Original Price","Brand Name","Discount","Thumbnail URL","Short Description","Images","Colors","Size","Rating Average","Review Count","Discount Rate","Quantity Sold","URL Key","URL Path","Short URL","Type","CreateTime"
"270791686","2037972460611","Dép đúc siêu nhẹ nam, nữ DUWA - Hàng chính hãng - TK2263","88500.0","159000.0","DUWA","70500.0","https://salt.tikicdn.com/cache/280x280/ts/product/f9/6c/2a/349a4a0e62c5ebb197df1ea04b5b3512.jpg","Các sản phẩm giày dép nam nữ được chúng tôi nghiên cứu kỹ lưỡng về size chân, sở thích, nhu cầu sử dụng của người Việt Nam.Điểm nổi bật của sản phẩm là kiểu dáng trẻ trung, năng động. Sản phẩm thiết...","https://salt.tikicdn.com/cache/w1200/ts/product/f9/6c/2a/349a4a0e62c5ebb197df1ea04b5b3512.jpg;https://salt.tikicdn.com/cache/w1200/ts/product/0a/46/5f/cafc3cf2ab1620b64b5d6de42d3b6a08.jpg;https://salt.tikicdn.com/cache/w1200/ts/product/96/39/dc/3e080d92ee6b2c39e26a5b7aef7dea22.jpg;https://salt.tikicdn.com/cache/w1200/ts/product/34/b0/37/7cdf75623d5f68a6cdee2e599951e14f.jpg;https://salt.tikicdn.com/cache/w1200/ts/product/76/36/69/1aa41c9ef2c29c6d03221921c617c6be.jpg;https://salt.tikicdn.com/cache/w1200/ts/product/ee/59/7e/2514ef59362cd31c649b94025be27e9f.jpg","màu đen;trắng","35;36;37;38;39;40;41;42","4.5","4","44","19","dep-duc-sieu-nhe-nam-nu-duwa-hang-chinh-hang-tk2263-p270791686","dep-duc-sieu-nhe-nam-nu-duwa-hang-chinh-hang-tk2263-p270791686.html?spid=270791688","https://tiki.vn/product-p270791686.html?spid=270791688","configurable","2024-11-05T19:26:46.956530200"
"55085257","5913884221483","Giày sandal nam Trường Hải da bò thật mềm mại màu nâu đế PU nhẹ nhàng không trơn hình ảnh thật SD0474","276000.0","319000.0","Trường Hải","43000.0","https://salt.tikicdn.com/cache/280x280/ts/product/4f/2f/d5/8906559ba64b9f3879d505596f5aa929.jpg","Giày sandal được làm bằng da bò cao cấp không bong tróc, càng đi lớp da càng mềm mại hạn chế tối đa tình trạng trầy xước khi va chạmĐế dép được làm bằng PU siêu nhẹ chẳng những êm ái mang lại sự thoải...","https://salt.tikicdn.com/cache/w1200/ts/product/4f/2f/d5/8906559ba64b9f3879d505596f5aa929.jpg;https://salt.tikicdn.com/cache/w1200/ts/product/1e/c6/a2/03c730c6724ed1f5d7fae70619d5e5eb.jpg;https://salt.tikicdn.com/cache/w1200/ts/product/ff/3e/2c/630d83ddf3c3b27f4bfa234b5089639c.jpg;https://salt.tikicdn.com/cache/w1200/ts/product/c0/a2/f3/9d109da07da09f9d9bf444be22cddf4a.jpg;https://salt.tikicdn.com/cache/w1200/ts/product/7a/5c/e6/ca1063a103aba164b56a521fc1a38c24.jpg","","","4.7","15","13","31","giay-sandal-nam-truong-hai-da-bo-that-mem-mai-mau-nau-de-pu-nhe-nhang-khong-tron-hinh-anh-that-sd0474-p55085257","giay-sandal-nam-truong-hai-da-bo-that-mem-mai-mau-nau-de-pu-nhe-nhang-khong-tron-hinh-anh-that-sd0474-p55085257.html?spid=55085269","https://tiki.vn/product-p55085257.html?spid=55085269","configurable","2024-11-05T19:26:50.717463600"
"42375448","6661845386625","Dép kẹp nam GIAVY - TL329","205000.0","205000.0","GIAVY","0.0","https://salt.tikicdn.com/cache/280x280/ts/product/4a/c0/12/7920d5cb60f70f1d34c5ada507cb39ac.png","Chất liệu vải dù mang êm, đường mai chắc chắn, đẹpThiết kế đế cao su với các rãnh chống trơn trượtĐế lớp lót giữa có mouse tạo độ đàn hồi nhất địnhMàu sắc trung tính dễ dàng kết hợp với nhiều trang ph...","https://salt.tikicdn.com/cache/w1200/ts/product/4a/c0/12/7920d5cb60f70f1d34c5ada507cb39ac.png;https://salt.tikicdn.com/cache/w1200/ts/product/c7/48/f2/05fc9e3a0eda42be58a798ae708e9c34.jpg;https://salt.tikicdn.com/cache/w1200/ts/product/7a/d2/4e/fa13ef4c227f78f6d260d4d82e16b8d2.jpg;https://salt.tikicdn.com/cache/w1200/ts/product/5a/1e/13/b525be4e1cf8a83336bd8d3c1cc923da.jpg;https://salt.tikicdn.com/cache/w1200/ts/product/28/e4/c8/5b19a790b928a70f3feb29d69b62b363.jpg;https://salt.tikicdn.com/cache/w1200/ts/product/b7/0d/7d/06d6705972725ee9a44ac23b72a4d0c7.jpg","đen","39;40;41;42;43","4.8","16","0","48","dep-kep-nam-giavy-tl329-p42375448","dep-kep-nam-giavy-tl329-p42375448.html?spid=42375452","https://tiki.vn/product-p42375448.html?spid=42375452","configurable","2024-11-05T19:26:55.070662700"
"107233238","9006171893287","Dép nhựa quai ngang siêu nhẹ Bitis nam","106000.0","106000.0","Biti's","0.0","https://salt.tikicdn.com/cache/280x280/ts/product/90/09/1f/fa4f6bee3f1116128c8bd5d339533622.jpg","Dép quai ngang nam Bitis có thiết kế đế nhẹ, êm chân thời trang trẻ trung và sang trọngĐế dép trệt giúp bạn thoải mái khi mangQuai nhưng êm, kết đính họa tiết bằng chỉ chắc chắnDép đã được thử lực...","https://salt.tikicdn.com/cache/w1200/ts/product/90/09/1f/fa4f6bee3f1116128c8bd5d339533622.jpg;https://salt.tikicdn.com/cache/w1200/ts/product/de/08/fa/3a194b2915109a389244a18b5657b00b.jpg;https://salt.tikicdn.com/cache/w1200/ts/product/47/83/c1/2ce390332fbd4fe9b58b656dffc6e1af.jpg;https://salt.tikicdn.com/cache/w1200/ts/product/eb/3f/37/9f956416e2c17c061bd35f22c0320bf3.jpg","","","4.8","69","0","280","dep-nhua-quai-ngang-sieu-nhe-bitis-nam-p107233238","dep-nhua-quai-ngang-sieu-nhe-bitis-nam-p107233238.html?spid=107233244","https://tiki.vn/product-p107233238.html?spid=107233244","configurable","2024-11-05T19:27:00.097989100"
"273896651","7325877661670","Giày Thể Thao Nam Biti's BSM000900DEN (Đen)","677000.0","751000.0","Biti's","74000.0","https://salt.tikicdn.com/cache/280x280/ts/product/2e/ea/b5/ba75defbe64b0431757a4f74e775ae1e.jpg","Giày Thể Thao Nam BSM000900 sở hữu thiết kế tuy đơn giản nhưng lại rất đặc biệt. Điều này thể hiện qua bảng màu đen, đi nét cam táo báo; cũng như form ôm trọn bàn chân quen thuộc với đầu mũi giày tròn...","https://salt.tikicdn.com/cache/w1200/ts/product/2e/ea/b5/ba75defbe64b0431757a4f74e775ae1e.jpg;https://salt.tikicdn.com/cache/w1200/ts/product/90/34/77/5d23588b804b7c711b051c1192e5fba5.JPG;https://salt.tikicdn.com/cache/w1200/ts/product/03/ed/fd/ab1079ffc94357cc0778cb7817c88258.JPG;https://salt.tikicdn.com/cache/w1200/ts/product/65/d5/ba/a156c446cf615e4a3e502ff956a4178a.JPG;https://salt.tikicdn.com/cache/w1200/ts/product/ed/c9/34/a818687a8159ce0dbcfb67bfee70ffdb.JPG;https://salt.tikicdn.com/cache/w1200/ts/product/4b/df/0e/2065759dc100b5fe53b670ec8cbd3140.JPG;https://salt.tikicdn.com/cache/w1200/ts/product/4e/eb/87/cf52b3f0c9bd54c6e7239fb015602a0f.JPG;https://salt.tikicdn.com/cache/w1200/ts/product/91/24/c3/78a5d20aebcc043796928537e57420a8.JPG;https://salt.tikicdn.com/cache/w1200/ts/product/c2/9f/e3/d35dacbc4bff7ae64c1c3736ad8145c5.JPG","","","4.0","1","10","10","giay-the-thao-nam-biti-s-bsm000900den-den-p273896651","giay-the-thao-nam-biti-s-bsm000900den-den-p273896651.html?spid=273896657","https://tiki.vn/product-p273896651.html?spid=273896657","configurable","2024-11-05T19:27:05.577762900"
"215214310","9389611087997","Dép nam quai ngang cao cấp siêu bền may quai sẵn KD2808 Full hộp","480000.0","480000.0","KEEDO","0.0","","Dép nam hai quai ngang cao cấp KEEDO KD2808Mã Sản Phẩm: KD2808- Màu Sắc: Đen- Bảo hành: 6 tháng- Chất Liệu: Đế cao su nguyên chất chống trơn trợt. Quai da tổng hợp may chỉ viền- Xuất xứ: Việt Nam...","https://salt.tikicdn.com/cache/w1200/media/catalog/product/f5/15/2228f38cf84d1b8451bb49e2c4537081.png","","","5.0","1","0","0","dep-nam-quai-ngang-cao-cap-sieu-ben-may-quai-san-kd2808-full-hop-p215214310","dep-nam-quai-ngang-cao-cap-sieu-ben-may-quai-san-kd2808-full-hop-p215214310.html","https://tiki.vn/product-p215214310.html","configurable","2024-11-05T19:27:10.595352300"
"75031062","4706977863452","Giày da nam Pierre Cardin PCMFWL 702 - màu đen","1190000.0","2990000.0","Pierre Cardin","1800000.0","https://salt.tikicdn.com/cache/280x280/ts/product/29/13/96/dfa62edf07ba888c654d9da0d946e62e.jpg","CHẤT LIỆU SẢN XUẤT:- Thân giày: da bò Nappa/ da bò Top - grain/ da bò bề mặt độ dày tiêu chuẩn 1.8mm. - Đế giày: cao su TPR cao cấp xẻ rãnh chống trượt.- Kiểu dáng giày Dress Shoes cao cấp chuẩn châ...","https://salt.tikicdn.com/cache/w1200/ts/product/29/13/96/dfa62edf07ba888c654d9da0d946e62e.jpg;https://salt.tikicdn.com/cache/w1200/ts/product/30/0d/c6/3bc199b0de52cb75d8cb1992d79acc72.jpg;https://salt.tikicdn.com/cache/w1200/ts/product/73/39/99/3f944cb36dbabdee50402b6bb3a68ef0.jpg;https://salt.tikicdn.com/cache/w1200/ts/product/e9/a1/f3/233b71bb00556ecbf5c3e09281d538d0.jpg;https://salt.tikicdn.com/cache/w1200/ts/product/04/e1/34/e36983df0e47b848a9e4843448555960.jpg","","","4.6","65","60","182","giay-da-nam-pierre-cardin-pcmfwle702blk-p75031062","giay-da-nam-pierre-cardin-pcmfwle702blk-p75031062.html?spid=75031066","https://tiki.vn/product-p75031062.html?spid=75031066","configurable","2024-11-05T19:27:14.438452300"
"186071797","7274327798361","Giày đốc nam da mềm, đế cao khâu đế thanh lịch","350000.0","350000.0","Giày Phong Cách Lê Sang S","0.0","https://salt.tikicdn.com/cache/280x280/ts/product/ae/aa/fc/366aca7ef5a013606143a930db56d901.jpg","Giày Đốc Lê Sang Đế TĂNG CHIỀU CAO Lịch Lãm với chất liệu bền đẹp kết hợp đế cao su êm nhẹ chống trơn trượt giúp bạn nam luôn thoải mái, tự tin khi đi chơi, dạo phố, đi làm nơi công sở hay đi dự tiệc....","https://salt.tikicdn.com/cache/w1200/ts/product/ae/aa/fc/366aca7ef5a013606143a930db56d901.jpg;https://salt.tikicdn.com/cache/w1200/ts/product/b0/20/4d/89ba8fc3bd86cfb2b42401bbacca13bf.jpg;https://salt.tikicdn.com/cache/w1200/ts/product/32/45/b8/80d42e0a363755a288e7e35bc890675f.jpg;https://salt.tikicdn.com/cache/w1200/ts/product/97/ef/4b/e3078c7d8b34ee8d113b530856e73322.jpg","da bóng mũi viền;mũi có viền;mũi trơn","","4.7","14","0","36","giay-doc-nam-da-mem-de-cao-khau-de-thanh-lich-p186071797","giay-doc-nam-da-mem-de-cao-khau-de-thanh-lich-p186071797.html?spid=186071823","https://tiki.vn/product-p186071797.html?spid=186071823","configurable","2024-11-05T19:27:19.103557400"
"191363362","9623048536956","Giày da nam, giày đốc nam trẻ trung nam Bụi Leather G122 - Da bò thật Nappa cao cấp - Bảo hành 12 tháng","969000.0","969000.0","Bụi Leather","0.0","https://salt.tikicdn.com/cache/280x280/ts/product/d6/e9/5e/c19592cb5a00e6320244ddb123842a81.jpg","...","https://salt.tikicdn.com/cache/w1200/ts/product/d6/e9/5e/c19592cb5a00e6320244ddb123842a81.jpg;https://salt.tikicdn.com/cache/w1200/ts/product/35/66/5e/5311ddbf67b26ce89696e0a73ad2c7b5.jpg;https://salt.tikicdn.com/cache/w1200/ts/product/1a/c6/19/6ffa098a087f62389f2ec913b9c56085.jpg;https://salt.tikicdn.com/cache/w1200/ts/product/be/1b/cb/ee585424f8e7e1508aaccd1c10b34227.jpg;https://salt.tikicdn.com/cache/w1200/ts/product/54/61/ae/54b10d467ca4bfccd9066fe7215826f6.jpg;https://salt.tikicdn.com/cache/w1200/ts/product/c6/4b/70/b6185706f8a2b60f624d36daeed0ed6a.jpg","","","4.8","38","0","113","giay-da-nam-giay-doc-nam-tre-trung-nam-bui-leather-g122-da-bo-that-nappa-cao-cap-bao-hanh-12-thang-p191363362","giay-da-nam-giay-doc-nam-tre-trung-nam-bui-leather-g122-da-bo-that-nappa-cao-cap-bao-hanh-12-thang-p191363362.html?spid=191363370","https://tiki.vn/product-p191363362.html?spid=191363370","configurable","2024-11-05T19:27:23.627712200"
"274920487","2459653267904","Giày Doctor Da Bò Full Đen SIGOURNEY Trẻ Trung Nam Tính SDR-03 Bảo Hành 18 Tháng","396000.0","595000.0","Sigourney","199000.0","https://salt.tikicdn.com/cache/280x280/ts/product/83/f8/14/32bce4a3272f711e9d1afa5f25c3d68c.png","NGUỒN GỐC HÀNG HÓA:- Địa chỉ: 568A Nguyễn Lương Bằng, Liên Chiểu, Đà Nẵng- Cơ sở sản xuất: Giày da nam Sigourney- Chủ cơ sở: Lê Tấn Nghĩaa) Thành phần:- Da Bò, Cao sub) Thông số kỹ thuật:• Tên sản ph...","https://salt.tikicdn.com/cache/w1200/ts/product/83/f8/14/32bce4a3272f711e9d1afa5f25c3d68c.png;https://salt.tikicdn.com/cache/w1200/ts/product/cf/17/1c/15dab47ea25956308f4e58dd32d55e00.jpg;https://salt.tikicdn.com/cache/w1200/ts/product/f9/2c/3a/365ac005b8afe60f8073dcbe88e7822f.jpg;https://salt.tikicdn.com/cache/w1200/ts/product/1f/c5/14/f172f0732edc878aaabb55e52de9e73c.jpg;https://salt.tikicdn.com/cache/w1200/ts/product/f0/70/54/dbc436579ef7ba858ac3767cdd8ee3aa.jpg;https://salt.tikicdn.com/cache/w1200/ts/product/19/97/41/361d8e3f9b47a04d25bfb377ba5fcfce.jpg;https://salt.tikicdn.com/cache/w1200/ts/product/57/08/ed/7fd9ef05cbb9bc439446bda9fdaef315.jpg;https://salt.tikicdn.com/cache/w1200/ts/product/e3/91/52/385bf705db402e746c085aa7b3521de4.jpg;https://salt.tikicdn.com/cache/w1200/ts/product/10/42/b8/065fb82ca6c75e11f1dc684122cbbab5.png;https://salt.tikicdn.com/cache/w1200/ts/product/de/c0/75/f7d96ba23e550295a124a369f40e3475.jpg","","","5.0","2","33","2","giay-doctor-da-bo-full-den-sigourney-tre-trung-nam-tinh-sdr-03-bao-hanh-18-thang-p274920487","giay-doctor-da-bo-full-den-sigourney-tre-trung-nam-tinh-sdr-03-bao-hanh-18-thang-p274920487.html?spid=274920495","https://tiki.vn/product-p274920487.html?spid=274920495","configurable","2024-11-05T19:27:28.318577100"
"275677678","7161059453741","Giày boots nam khóa kéo đế combat tăng 5cm - khóa kéo combat","249000.0","400000.0","Giày Phong Cách Lê Sang S","151000.0","https://salt.tikicdn.com/cache/280x280/ts/product/05/a3/46/780ccfebb2617180874dca13bb1d19cf.jpg","Giày Đốc Lê Sang Đế TĂNG CHIỀU CAO Lịch Lãm với chất liệu bền đẹp kết hợp đế cao su êm nhẹ chống trơn trượt giúp bạn nam luôn thoải mái, tự tin khi đi chơi, dạo phố, đi làm nơi công sở hay đi dự tiệc....","https://salt.tikicdn.com/cache/w1200/ts/product/05/a3/46/780ccfebb2617180874dca13bb1d19cf.jpg;https://salt.tikicdn.com/cache/w1200/ts/product/7a/00/fd/a890b1d6e98fc009a6f9769e7aa1136e.jpg;https://salt.tikicdn.com/cache/w1200/ts/product/f5/a9/cf/24425322379313f5e4d37322f000a51b.jpg","","","5.0","1","38","3","giay-boots-nam-khoa-keo-de-combat-tang-5cm-khoa-keo-combat-p275677678","giay-boots-nam-khoa-keo-de-combat-tang-5cm-khoa-keo-combat-p275677678.html?spid=275677686","https://tiki.vn/product-p275677678.html?spid=275677686","configurable","2024-11-05T19:27:32.825239"
"7977159","9820260544349","Giày Tây Nam Da Bò Sunpolo SUMU234","750000.0","750000.0","SUNPOLO","0.0","https://salt.tikicdn.com/cache/280x280/ts/product/5b/7b/6c/2a7093acd5659f16561c39e9b8f8fc1d.jpg","Giày Tây Nam Da Bò SUNPOLO SUMU234 được làm bằng chất liệu da bò bền đẹp kết hợp đế cao su xẻ rãnh êm nhẹ chống trơn trượt giúp cho bạn thật thoải mái, tự tin cùng vẻ ngoài sang trọng, lịch lãm nơi c...","https://salt.tikicdn.com/cache/w1200/ts/product/5b/7b/6c/2a7093acd5659f16561c39e9b8f8fc1d.jpg;https://salt.tikicdn.com/cache/w1200/ts/product/3a/7b/31/b09d264b3e2cdf75424f509be5458126.jpg;https://salt.tikicdn.com/cache/w1200/ts/product/e8/7a/5d/f679f9fdaee15f8921348ee4c22da528.jpg;https://salt.tikicdn.com/cache/w1200/ts/product/40/dd/4f/f9b010c5163e49aeca03b16dcc4e9efe.jpg;https://salt.tikicdn.com/cache/w1200/ts/product/20/d4/12/25f07659c26ad89410edb21043cef771.jpg;https://salt.tikicdn.com/cache/w1200/ts/product/e4/7e/82/0d2cb4e74997a2094aa35cd865cf9fd3.jpg","nâu;đen","38;39;40;41;42;43","4.8","4","0","29","giay-tay-nam-da-bo-sunpolo-sumu234-p7977159","giay-tay-nam-da-bo-sunpolo-sumu234-p7977159.html?spid=7986031","https://tiki.vn/product-p7977159.html?spid=7986031","configurable","2024-11-05T19:27:37.904105500"
"275276395","4722804538683","Dép tổ ong TRẮNG vật liệu EVA siêu bền, siêu nhẹ, chống trơn trượt, Form SIZE LỚN CHÂU ÂU","63000.0","85000.0","VAC ","22000.0","https://salt.tikicdn.com/cache/280x280/ts/product/4e/cc/15/37516c9fd2ac0e39cb8fdb268872963e.jpg","Dép “Tổ ong” huyền thoại nay đã có phiên bản mới, SIÊU NHẸ, SIÊU ÊM, SIÊU KOOL, NHIỀU MÀU SẮC - Dép được sản xuất từ nhựa E.V.A nhập khẩu nguồn gốc Taiwan, Korea (Nói không với Trung Quốc), cực kỳ th...","https://salt.tikicdn.com/cache/w1200/ts/product/4e/cc/15/37516c9fd2ac0e39cb8fdb268872963e.jpg","","","0.0","0","26","17","dep-to-ong-trangvat-lieu-eva-sieu-ben-sieu-nhe-chong-tron-truot-form-size-lon-chau-au-p275276395","dep-to-ong-trangvat-lieu-eva-sieu-ben-sieu-nhe-chong-tron-truot-form-size-lon-chau-au-p275276395.html?spid=275276397","https://tiki.vn/product-p275276395.html?spid=275276397","configurable","2024-11-05T19:27:42.881890900"
"248092080","5446076223365","Giày lười nam da bò buộc dây Trường Hải màu nâu đề cao 3cm GM446N","598000.0","749000.0","Trường Hải","151000.0","https://salt.tikicdn.com/cache/280x280/ts/product/aa/22/67/d2a4256c23ef341c722611243fa5ef20.jpg","Giày lười nam da bò buộc dây  màu nâu đề cao 3cm GM446N được sản xuất tại Việt Nam được thiết kế đơn giản trẻ trung phù hợp mọi lứa tuổi dễ dàng mang vào tháo ra 1 cách nhanh chóng thuận tiện để đi họ...","https://salt.tikicdn.com/cache/w1200/ts/product/aa/22/67/d2a4256c23ef341c722611243fa5ef20.jpg;https://salt.tikicdn.com/cache/w1200/ts/product/2b/e2/b2/31aae6c492569c0a7e22094a4565443c.jpg;https://salt.tikicdn.com/cache/w1200/ts/product/c3/95/a5/9d30b9957992c2fcc7f97edd9ab231ce.jpg;https://salt.tikicdn.com/cache/w1200/ts/product/16/c2/eb/2c188b4d467fd6ff827ad23ec0313987.jpg;https://salt.tikicdn.com/cache/w1200/ts/product/76/81/79/0257e67966f1698dd7675f85c8facfe0.jpg","màu nâu","38;39;40;41;42;43","5.0","1","20","2","giay-luoi-nam-da-bo-buoc-day-truong-hai-mau-nau-de-cao-3cm-gm446n-p248092080","giay-luoi-nam-da-bo-buoc-day-truong-hai-mau-nau-de-cao-3cm-gm446n-p248092080.html?spid=248092086","https://tiki.vn/product-p248092080.html?spid=248092086","configurable","2024-11-05T19:27:46.264454600"
"274999556","6038168570888","Giày thể thao nam - nữ cổ cao đế êm nhẹ, thoáng khí đế cao su đúc, chống trơn trượt hạn chế mòn – BEE GEE - G1012","550000.0","1100000.0","Bee Gee","550000.0","https://salt.tikicdn.com/cache/280x280/ts/product/e2/9a/9c/fc3c260f25c2d1e1adf666982c22a38c.jpg","Giày thể thao nam nữ thời trang, giày chạy bộ nam nữ ôm chân thoáng khíGiày được thiết kế đẹp mắt, có tính thẩm mỹ caoThiết kế da cao cấp mềm, thoáng khíMũi giày ôm theo dáng bàn chân, không gây kh...","https://salt.tikicdn.com/cache/w1200/ts/product/e2/9a/9c/fc3c260f25c2d1e1adf666982c22a38c.jpg;https://salt.tikicdn.com/cache/w1200/ts/product/c1/17/22/7a370086ed28a8bf58ee79302a608156.jpg;https://salt.tikicdn.com/cache/w1200/ts/product/5b/e2/0c/373ea129ab2797fdf99fc8ec50e8d0b8.jpg;https://salt.tikicdn.com/cache/w1200/ts/product/5a/0f/65/51a4aa9edbc7b99f6263a9cfacafbbd7.jpg;https://salt.tikicdn.com/cache/w1200/ts/product/80/fb/1e/292097eb092fcc3021b1e119bc44bcb8.jpg","kem;đen","","4.0","1","50","2","giay-the-thao-nam-nu-de-em-nhe-thoang-khi-de-cao-su-duc-chong-tron-truot-han-che-mon-bee-gee-g1012-p274999556","giay-the-thao-nam-nu-de-em-nhe-thoang-khi-de-cao-su-duc-chong-tron-truot-han-che-mon-bee-gee-g1012-p274999556.html?spid=274999560","https://tiki.vn/product-p274999556.html?spid=274999560","configurable","2024-11-05T19:27:50.122879200"
"186071834","2249611003680","Giày sục tây thời trang nam thời thượng, mẫu mới nhất 2022","250000.0","250000.0","Giày Phong Cách Lê Sang S","0.0","https://salt.tikicdn.com/cache/280x280/ts/product/0c/3e/42/1a974abd6214f46eeaf75475bcfa9876.jpg","Giày Sục Tây Nam Lê Sang Da Nhám Đai với chất liệu bền đẹp kết hợp đế cao su êm nhẹ chống trơn trượt giúp bạn nam luôn thoải mái, tự tin khi đi chơi, dạo phố, đi làm nơi công sở hay đi dự tiệc.Giày đư...","https://salt.tikicdn.com/cache/w1200/ts/product/0c/3e/42/1a974abd6214f46eeaf75475bcfa9876.jpg;https://salt.tikicdn.com/cache/w1200/ts/product/80/a2/d4/c4fadba71eb87857dc888771d522e486.jpg","da bóng;da nhám","","0.0","0","0","1","giay-suc-tay-thoi-trang-nam-thoi-thuong-mau-moi-nhat-2022-p186071834","giay-suc-tay-thoi-trang-nam-thoi-thuong-mau-moi-nhat-2022-p186071834.html?spid=186071836","https://tiki.vn/product-p186071834.html?spid=186071836","configurable","2024-11-05T19:27:54.417638300"
"13883504","6854668665392","Giày sneaker TMN05404","700000.0","700000.0","TOMOYO","0.0","https://salt.tikicdn.com/cache/280x280/ts/product/60/c0/fe/0f16153b2390f282ec17acade2246853.jpg"," Chất liệu:+ Da Polyurethane cao cấp bên ngoài, bền màu, màu sắc đẹp, sang trọng.+ Lớp lót, talon: bằng chất liệu da bò, xuyên suốt đến TẬN MŨI GIÀY  giúp đem lại cảm giác cực kỳ êm ái và bảo vệ đôi ...","https://salt.tikicdn.com/cache/w1200/ts/product/a2/ae/a5/0315a8d968f7a856ed27a62a970e2706.jpg","","","3.3","3","0","0","giay-sneaker-tmn05404-p13883504","giay-sneaker-tmn05404-p13883504.html","https://tiki.vn/product-p13883504.html","configurable","2024-11-05T19:27:58.693186"
"275813835","6916459564884","Sandal Nam Biti's BEM002000 Siêu Nhẹ Chống Trơn Trượt","419000.0","419000.0","Biti's","0.0","https://salt.tikicdn.com/cache/280x280/ts/product/b4/ac/ae/70bfbdf7251d28a5ce548c381677ff31.png","Không thể phủ nhận rằng sandal là loại giày sở hữu vô vàn ưu điểm nổi bật như tiện lợi, thoải mái, thoáng mát, chắc chắn. Nếu bạn dự tính mua cho mình một đôi sandal trong thời gian tới nhưng chưa ưng...","https://salt.tikicdn.com/cache/w1200/ts/product/b4/ac/ae/70bfbdf7251d28a5ce548c381677ff31.png;https://salt.tikicdn.com/cache/w1200/ts/product/44/25/db/12a70b5ab70bff0eb7f9b1cdec5ffa7c.png;https://salt.tikicdn.com/cache/w1200/ts/product/0d/e2/ed/6dd6833bbe28424777a43cbdca96e76c.png;https://salt.tikicdn.com/cache/w1200/ts/product/fb/46/1d/39e89f40364874a45349a47817865a25.png;https://salt.tikicdn.com/cache/w1200/ts/product/ab/ef/34/4a634b3bd61a4a31c0bc4b0df6c603f6.png;https://salt.tikicdn.com/cache/w1200/ts/product/7a/e0/c3/1b87c5c9fb701538cd8d325a6be1be87.png;https://salt.tikicdn.com/cache/w1200/ts/product/4a/16/be/3e1502cd5458ac8234c323b5c98e899e.png","màu đen;xám","39;40;41;42;43","0.0","0","0","1","sandal-nam-biti-s-bem002000-sieu-nhe-chong-tron-truot-p275813835","sandal-nam-biti-s-bem002000-sieu-nhe-chong-tron-truot-p275813835.html?spid=275813851","https://tiki.vn/product-p275813835.html?spid=275813851","configurable","2024-11-05T19:28:03.655545500"
"273270046","9353808633818","Gói 30 tờ giấy ướt lau giày vàng chuyên dụng - Hàng Nhập Khẩu","35000.0","35000.0","ASSTAR","0.0","https://salt.tikicdn.com/cache/280x280/ts/product/0b/d1/0c/12a9201c7aab9231c7a3f12f49eb7b3b.jpg","Tên sản phẩm : Gói 30 tờ giấy ướt lau giầy chuyên dụng Công dụng : Lau sạch giầy, dép, túi xách, ba lôChất liệu : Giấy ướt tẩm dung dịch làm sạch và bóng giầyMàu sắc : Trắng (Hộp màu vàng) Kích thư...","https://salt.tikicdn.com/cache/w1200/ts/product/0b/d1/0c/12a9201c7aab9231c7a3f12f49eb7b3b.jpg;https://salt.tikicdn.com/cache/w1200/ts/product/50/06/62/aa5d0bd5a8fd40951a9002128a23214b.jpg;https://salt.tikicdn.com/cache/w1200/ts/product/57/57/c3/8c83978df311c95c8db1e9955c3869bc.jpg;https://salt.tikicdn.com/cache/w1200/ts/product/00/d1/f1/c96e77c6522ef77db438432b8c7fb09a.jpg;https://salt.tikicdn.com/cache/w1200/ts/product/b9/d5/c8/ddd4095acc9ed69b1792b42baa5dd775.jpg;https://salt.tikicdn.com/cache/w1200/ts/product/18/ef/f4/3f3753c8954a9076b064c388f7905291.jpg","","","5.0","1","0","9","goi-30-to-giay-uot-lau-giay-chuyen-dung-sneaker-hang-nhap-khau-p273270046","goi-30-to-giay-uot-lau-giay-chuyen-dung-sneaker-hang-nhap-khau-p273270046.html?spid=273270047","https://tiki.vn/product-p273270046.html?spid=273270047","simple","2024-11-05T19:28:07.883885100"
"262680740","8074604848151","Giày lười nam da bò cao cấp Pierre Cardin, thiết kế đế chống trượt, thời trang, dễ phối đồ PCMFWL 706","1190000.0","2490000.0","Pierre Cardin","1300000.0","https://salt.tikicdn.com/cache/280x280/ts/product/a7/45/3b/3a3ce2887fb479025e9dcab27af9d6aa.png","Sản Phẩm: Giày Horsebit Driving Pierre Cardin - PCMFWLG 7061. Thông Tin Sản Phẩm thuộc dòng giày mọi, không dây, thuận tiện khi sử dụng. Đặc biệt, đế giày có độ bám dính rất cao, tránh trơn trượt nê...","https://salt.tikicdn.com/cache/w1200/ts/product/a7/45/3b/3a3ce2887fb479025e9dcab27af9d6aa.png;https://salt.tikicdn.com/cache/w1200/ts/product/9d/99/d6/794cd5e7478f5ff44af15fd0bdfa9a39.png;https://salt.tikicdn.com/cache/w1200/ts/product/2f/92/8f/01e841221c947984cc58b97f9aa96cfe.png","nâu;vàng gold;xanh navy","","5.0","2","52","14","giay-casual-nam-pierre-cardin-706-p262680740","giay-casual-nam-pierre-cardin-706-p262680740.html?spid=262680745","https://tiki.vn/product-p262680740.html?spid=262680745","configurable","2024-11-05T19:28:13.042738900"
